{
  "course_id": 24139,
  "start_date": "2025-08-26 00:00:00",
  "end_date": "2025-12-15 23:59:59",
  "default_due_day": 6,
  "default_discussion_due_day": 3,
  "default_last_day": 4,
  "build_type": 2,
  "overview_page_template": "Module 1: Overview",
  "discussion_template": "Group Discussion: [Title Here]",
  "assignment_template": "Individual Assignment: [Title Here]",
  "newquiz_template": "New Quiz: [Title Here]",
  "classicquiz_template": "Classic Quiz: [Title Here]",
  "course": {
    "course_code": "SOC 1300",
    "course_name": "Intro to Sociology",
    "description": "Introduction to the concepts of sociology. The structure and processes of social life are studied.",
    "instructor": [
      {
        "name": "TBD",
        "email": ""
      }
    ],
    "year": 2025,
    "term": "FA",
    "start_at": "2025-08-25",
    "end_at": "2025-10-10",
    "credits": 3,
    "objectives": [
      "Identify critical knowledge within the discipline of Sociology",
      "Critically analyze and evaluate sociological issues",
      "Integrate Biblical truth with the study of society"
    ],
    "textbooks": [
      "Introduction to Sociology: Understanding and Changing the Social World by Steve Barkan available from LibreTexts.",
      "Redeeming Sociology: A God-Centered Approach by Vern Poythress available from authorâ€™s website."
    ],
    "course_policy": "This course requires regular participation in a variety of activities: reading, writing, researching, taking quizzes and exams, and discussing relevant topics with your classmates. If you are diligent in keeping up with the assignments and following the directions, you should do well in this course. If you want to submit an assignment late, you should email the instructor as soon as possible (preferably before the assignment is due) to explain any extenuating circumstances.",
    "modules": [
      {
        "id": 1,
        "name": "Module 1: Sociology and Research Methods",
        "number": 1,
        "position": 4,
        "overview": "",
        "objectives": [
          "Recognize basic terminology and concepts related to sociology and research methods",
          "Utilize existing data from sociological research",
          "Analyze and evaluate sociological issues from a Biblical perspective",
          "Recognize how Biblical truth can be integrated with the study of society"
        ],
        "assessments": [],
        "assignments": [
          {
            "id": "q1",
            "name": "Barkan Quiz Chapter 1",
            "type": "quiz"
          },
          {
            "id": "q2",
            "name": "Barkan Quiz Chapter 2",
            "type": "quiz"
          },
          {
            "id": "q3",
            "name": "Poythress Quiz Module 1",
            "type": "quiz"
          },
          {
            "id": "q4",
            "name": "Module 1 Data Assignment",
            "type": "quiz"
          },
          {
            "id": "d1",
            "name": "Module 1 Discussion",
            "type": "discussion"
          },
          {
            "id": "a1",
            "name": "Christians and Sociology Reflection Paper",
            "type": "assignment"
          }
        ],
        "content": [
          "<a href=\"#new_page\">Module 1 Intro</a>",
          "Read Barkan Ch. 1 & 2",
          "Read Poythress App. B, C, D, & E"
        ],
        "pages": [
          {
            "id": "p1",
            "title": "Module 1 Intro"
          }
        ],
        "files": []
      },
      {
        "id": 2,
        "name": "Module 2: Socialization, Groups, and Deviance",
        "number": 2,
        "position": 5,
        "overview": "",
        "objectives": [
          "Recognize of basic terminology and concepts related to socialization, groups, and deviance",
          "Utilize existing data from sociological research",
          "Analyze and evaluate sociological issues from a Biblical perspective",
          "Recognize of how Biblical truth can be integrated with the study of society"
        ],
        "assessments": [],
        "assignments": [
          {
            "id": "q5",
            "name": "Barkan Quiz Chapter 3",
            "type": "quiz"
          },
          {
            "id": "q6",
            "name": "Barkan Quiz Chapter 4",
            "type": "quiz"
          },
          {
            "id": "q7",
            "name": "Barkan Quiz Chapter 5",
            "type": "quiz"
          },
          {
            "id": "q8",
            "name": "Poythress Quiz Module 2",
            "type": "quiz"
          },
          {
            "id": "q9",
            "name": "Module 2 Data Assignment",
            "type": "quiz"
          },
          {
            "id": "d2",
            "name": "Module 2 Discussion",
            "type": "discussion"
          }
        ],
        "content": [
          "<a href=\"#new_page\">Module 2 Intro</a>",
          "Read Barkan Ch. 3, 4, & 5",
          "Read Poythress Ch. 8, 22, & 23"
        ],
        "pages": [
          {
            "id": "p2",
            "title": "Module 2 Intro"
          }
        ],
        "files": []
      },
      {
        "id": 3,
        "name": "Module 3: Social Inequalities",
        "number": 3,
        "position": 6,
        "overview": "",
        "objectives": [
          "Recognize basic terminology and concepts related to social inequalities",
          "Utilize existing data from sociological research",
          "Analyze and evaluate sociological issues from a Biblical perspective",
          "Recognize how Biblical truth can be integrated with the study of society"
        ],
        "assessments": [],
        "assignments": [
          {
            "id": "q10",
            "name": "Barkan Quiz Chapter 6",
            "type": "quiz"
          },
          {
            "id": "q11",
            "name": "Barkan Quiz Chapter 7",
            "type": "quiz"
          },
          {
            "id": "q12",
            "name": "Barkan Quiz Chapter 8",
            "type": "quiz"
          },
          {
            "id": "q13",
            "name": "Poythress Quiz Module 3",
            "type": "quiz"
          },
          {
            "id": "q14",
            "name": "Module 3 Data Assignment",
            "type": "quiz"
          },
          {
            "id": "d3",
            "name": "Module 3 Discussion",
            "type": "discussion"
          }
        ],
        "content": [
          "<a href=\"#new_page\">Module 3 Intro</a>",
          "Barkan Ch. 6, 7, & 8",
          "Poythress Ch. 17, 26, & 27"
        ],
        "pages": [
          {
            "id": "p3",
            "title": "Module 3 Intro"
          }
        ],
        "files": []
      },
      {
        "id": 4,
        "name": "Module 4: Book Review",
        "number": 4,
        "position": 7,
        "overview": "",
        "objectives": [
          "Recognize basic terminology and concepts related to the sociological topics in a given issue",
          "Analyze and evaluate sociological issues from a Biblical perspective"
        ],
        "assessments": [],
        "assignments": [
          {
            "id": "a2",
            "name": "Book Review",
            "type": "assignment"
          }
        ],
        "content": [
          "Complete a book review"
        ],
        "pages": [],
        "files": []
      },
      {
        "id": 5,
        "name": "Module 5: Aging, Political Order, and Economy",
        "number": 5,
        "position": 8,
        "overview": "",
        "objectives": [
          "Recognize basic terminology and concepts related to aging, political order, and economy",
          "Utilize existing data from sociological research",
          "Analyze and evaluate sociological issues from a Biblical perspective",
          "Recognize how Biblical truth can be integrated with the study of society"
        ],
        "assessments": [],
        "assignments": [
          {
            "id": "q15",
            "name": "Barkan Quiz Chapter 9",
            "type": "quiz"
          },
          {
            "id": "q16",
            "name": "Barkan Quiz Chapter 10",
            "type": "quiz"
          },
          {
            "id": "q17",
            "name": "Poythress Quiz Module 5",
            "type": "quiz"
          },
          {
            "id": "q18",
            "name": "Module 5 Data Assignment",
            "type": "quiz"
          }
        ],
        "content": [
          "<a href=\"#new_page\">Module 5 Intro</a>",
          "Barkan Ch. 9 & 10",
          "Poythress Ch. 25"
        ],
        "pages": [
          {
            "id": "p4",
            "title": "Module 5 Intro"
          }
        ],
        "files": []
      },
      {
        "id": 6,
        "name": "Module 6: Family, Education, and Religion",
        "number": 6,
        "position": 9,
        "overview": "",
        "objectives": [
          "Recognize basic terminology and concepts related to family, education, and religion",
          "Utilize existing data from sociological research",
          "Analyze and evaluate sociological issues from a Biblical perspective",
          "Recognize how Biblical truth can be integrated with the study of society"
        ],
        "assessments": [],
        "assignments": [
          {
            "id": "q19",
            "name": "Barkan Quiz Chapter 11",
            "type": "quiz"
          },
          {
            "id": "q20",
            "name": "Barkan Quiz Chapter 12",
            "type": "quiz"
          },
          {
            "id": "q21",
            "name": "Poythress Quiz Module 6",
            "type": "quiz"
          },
          {
            "id": "q22",
            "name": "Module 6 Data Assignment",
            "type": "quiz"
          }
        ],
        "content": [
          "<a href=\"#new_page\">Module 6 Intro</a>",
          "Barkan Ch. 11 & 12",
          "Poythress App. F"